Behavior_Big5,Message
"[Emotional Eating, Agreeableness]","You always support others—remember to support yourself by choosing nourishing, mindful meals."
"[Emotional Eating, Agreeableness]","Emotional eating can be a sign you need comfort. Instead of food, reach out to a loved one for support."
"[Emotional Eating, Agreeableness]",Your kind nature means you often care for others first. Take time to nourish yourself with mindful eating.
"[Emotional Eating, Agreeableness]","If emotions drive your eating, pause and ask yourself: ‘What would I say to a friend in this moment?’"
"[Emotional Eating, Agreeableness]",Turn emotional eating into mindful self-care—choose foods that truly make you feel good inside and out.
"[Emotional Eating, Agreeableness]",Your empathy is a gift—use it to be kind to yourself by eating in a way that honors your body’s needs.
"[Emotional Eating, Agreeableness]","When feeling down, connect with a friend instead of turning to food. Your relationships bring you true joy."
"[Emotional Eating, Agreeableness]","Instead of eating for comfort, engage in a kind act for yourself—write a note of encouragement or take a mindful walk."
"[Emotional Eating, Agreeableness]",Let mealtime be a time of self-love—eat slowly and appreciate the nourishment your food provides.
"[Emotional Eating, Agreeableness]",Use your natural warmth to create a positive relationship with food—eat with gratitude and joy.
"[Emotional Eating, Agreeableness]","If stress tempts you to eat, try practicing gratitude—thinking of three things you appreciate can shift your mindset."
"[Emotional Eating, Agreeableness]","Comfort yourself with connection rather than food—talk to a loved one, hug a pet, or enjoy a peaceful moment."
"[Emotional Eating, Agreeableness]",Be patient with yourself—mindful eating isn’t about perfection but about building a compassionate habit.
"[Emotional Eating, Agreeableness]","When emotions feel overwhelming, take deep breaths before meals to center yourself in the present moment."
"[Emotional Eating, Agreeableness]","Your kindness extends to how you treat yourself—eat with love, not guilt, and enjoy each bite mindfully."
"[Emotional Eating, Agreeableness]","Before eating for comfort, check in with yourself—are you physically hungry or emotionally seeking care?"
"[Emotional Eating, Agreeableness]","Create a self-care toolkit that includes mindful eating, journaling, and reaching out to supportive friends."
"[Emotional Eating, Agreeableness]","When emotional cravings hit, drink a glass of water and take a moment to reflect before making a food choice."
"[Emotional Eating, Agreeableness]",Your strong sense of harmony can extend to your eating habits—choose foods that bring balance to your body and mind.
"[Emotional Eating, Agreeableness]","Find comfort in mindful rituals rather than emotional eating—light a candle, play calming music, or enjoy a warm drink."
"[Emotional Eating, Agreeableness]",Replace emotional snacking with an act of kindness—send a thoughtful message to someone you care about.
"[Emotional Eating, Agreeableness]",Your generosity includes yourself—allow time for mindful meals as a way to nurture your well-being.
"[Emotional Eating, Agreeableness]","Choose foods that truly nourish your heart and mind, rather than eating out of stress or habit."
"[Emotional Eating, Agreeableness]","If stress triggers cravings, try shifting focus to something soothing—reading, stretching, or listening to music."
"[Emotional Eating, Agreeableness]","Your emotions are valid. Treat yourself with the same kindness you show others, starting with how you eat."
"[Emotional Eating, Agreeableness]",You deserve to feel good. Make food choices that support both your emotions and your long-term health.
"[Emotional Eating, Agreeableness]",Turn meals into an experience of gratitude—appreciate the flavors and how they nourish your body.
"[Emotional Eating, Agreeableness]",Eating is a moment of self-care. Approach it with the same kindness you offer to those around you.
"[Emotional Eating, Agreeableness]","If emotional eating feels automatic, pause for a moment and ask: ‘What else could bring me comfort right now?’"
"[Emotional Eating, Agreeableness]","Let meals be a time of peace—put away distractions and focus on the flavors, textures, and warmth of your food."
