Behavior_Big5,Message
"[Snacking Habits, Neuroticism]","When stress strikes, pause before snacking—ask yourself if you’re truly hungry or just seeking comfort."
"[Snacking Habits, Neuroticism]",Keep healthy snacks on hand to prevent stress-driven eating that may lead to regret later.
"[Snacking Habits, Neuroticism]",Opt for nutrient-dense snacks that stabilize your mood and prevent energy crashes.
"[Snacking Habits, Neuroticism]","Snacking mindfully can help reduce anxiety—focus on the taste, texture, and satisfaction of each bite."
"[Snacking Habits, Neuroticism]",Create a snack routine to add structure and reduce impulsive eating driven by emotions.
"[Snacking Habits, Neuroticism]","If you're feeling overwhelmed, drink a glass of water before reaching for a snack to check in with your true hunger."
"[Snacking Habits, Neuroticism]",Avoid eating directly from large packages—pre-portion your snacks to stay in control.
"[Snacking Habits, Neuroticism]",A balanced snack with protein and fiber can help manage stress-related hunger spikes.
"[Snacking Habits, Neuroticism]","Emotional snacking is common—be kind to yourself and aim for balanced, intentional choices."
"[Snacking Habits, Neuroticism]",Try deep breathing or stretching before snacking to see if stress relief is what you truly need.
"[Snacking Habits, Neuroticism]",Keep a journal to track your emotions and snacking habits—it can help identify triggers and patterns.
"[Snacking Habits, Neuroticism]",Healthy snacking is about balance—allow yourself a treat but pair it with something nutritious.
"[Snacking Habits, Neuroticism]",Avoid skipping meals to prevent excessive snacking due to hunger or emotional cravings.
"[Snacking Habits, Neuroticism]","Prepare satisfying, healthy snacks in advance so you're not reaching for processed foods in moments of stress."
"[Snacking Habits, Neuroticism]","If you feel the urge to snack when anxious, go for a short walk first and then reassess your hunger."
"[Snacking Habits, Neuroticism]",Eating snacks slowly can help prevent overindulging due to stress or emotional distress.
"[Snacking Habits, Neuroticism]",Keep nutritious options in visible places so making healthy choices becomes effortless.
"[Snacking Habits, Neuroticism]",Avoid distractions while snacking—turn off screens and focus on enjoying your food.
"[Snacking Habits, Neuroticism]","Don’t label snacks as 'good' or 'bad'—instead, aim for mindful and intentional eating habits."
"[Snacking Habits, Neuroticism]",Try herbal tea or a handful of nuts when feeling emotionally overwhelmed—it can help soothe and nourish.
"[Snacking Habits, Neuroticism]",Having structured snack times reduces unplanned emotional snacking.
"[Snacking Habits, Neuroticism]",Practice self-compassion—one unplanned snack won’t ruin your progress.
"[Snacking Habits, Neuroticism]","Use mindful snacking as a tool for self-care, choosing foods that truly nourish your body."
"[Snacking Habits, Neuroticism]",Plan snacks that provide steady energy to help maintain emotional balance throughout the day.
"[Snacking Habits, Neuroticism]","If you often snack due to stress, explore non-food coping strategies like journaling or deep breathing."
"[Snacking Habits, Neuroticism]",Choose whole foods like fruits and nuts that keep you full and provide steady energy.
"[Snacking Habits, Neuroticism]",Avoid snacking when feeling rushed or anxious—take a moment to breathe before making food choices.
"[Snacking Habits, Neuroticism]",Try to identify if you’re snacking due to real hunger or an emotional response.
"[Snacking Habits, Neuroticism]",A little planning can help you make better snack choices—prepare healthy options ahead of time.
"[Snacking Habits, Neuroticism]","Be patient with yourself—developing mindful snacking habits takes time, and small changes add up."
