Behavior_Big5,Message
"[Snacking Habits, Agreeableness]",Snacking mindfully allows you to nourish yourself with the same kindness you show others.
"[Snacking Habits, Agreeableness]",Choose snacks that give you steady energy so you can continue being there for those around you.
"[Snacking Habits, Agreeableness]",Healthy snacking isn’t just for you—share nutritious snack ideas with friends and family!
"[Snacking Habits, Agreeableness]",Prepare snacks ahead of time so you and your loved ones always have nourishing options available.
"[Snacking Habits, Agreeableness]",Your thoughtful nature makes you great at caring for others—don’t forget to care for yourself with healthy snacks.
"[Snacking Habits, Agreeableness]",Snacking can be a great way to bond—invite a friend to share a nutritious snack with you!
"[Snacking Habits, Agreeableness]",Balance is key—enjoy your favorite snacks while making choices that support your well-being.
"[Snacking Habits, Agreeableness]",Listen to your body’s hunger cues and choose snacks that leave you feeling satisfied and energized.
"[Snacking Habits, Agreeableness]","Choosing whole, nutritious snacks is a way to show kindness to your body."
"[Snacking Habits, Agreeableness]",Your generosity extends to food—prepare healthy snacks for yourself and those around you.
"[Snacking Habits, Agreeableness]","Make snacking a mindful act—pause, enjoy, and appreciate each bite."
"[Snacking Habits, Agreeableness]",Healthy snacks help sustain your energy so you can continue spreading positivity and kindness.
"[Snacking Habits, Agreeableness]",Snacking with intention allows you to make choices that align with your values and health goals.
"[Snacking Habits, Agreeableness]",Support those around you by encouraging better snack choices—good habits are contagious!
"[Snacking Habits, Agreeableness]",Snacking can be a moment of self-care—choose foods that truly nourish you.
"[Snacking Habits, Agreeableness]",Be mindful of emotional snacking—pause and ask yourself if you’re truly hungry or in need of a break.
"[Snacking Habits, Agreeableness]","Prepare snack boxes with a mix of protein, fiber, and healthy fats to keep you fueled throughout the day."
"[Snacking Habits, Agreeableness]",Choosing nutritious snacks ensures you stay energized and ready to help those around you.
"[Snacking Habits, Agreeableness]",Make snack time a moment of gratitude—appreciate the nourishment it provides.
"[Snacking Habits, Agreeableness]",Offer healthy snack alternatives when hosting gatherings—balance can be delicious!
"[Snacking Habits, Agreeableness]",Eating snacks with intention allows you to enjoy them more while avoiding overindulgence.
"[Snacking Habits, Agreeableness]",Try making homemade snacks with loved ones—it’s a fun and rewarding way to practice mindful eating.
"[Snacking Habits, Agreeableness]",Keep a variety of healthy snacks on hand to make balanced choices easy.
"[Snacking Habits, Agreeableness]",Think of snacks as fuel—choose foods that support your energy and overall well-being.
"[Snacking Habits, Agreeableness]",Encourage mindful snacking in your community—share your favorite healthy options with friends!
"[Snacking Habits, Agreeableness]","If you tend to snack when stressed, try a deep breath before eating to check in with your hunger levels."
"[Snacking Habits, Agreeableness]","Choosing fresh, whole foods for snacks helps maintain balance and long-term health."
"[Snacking Habits, Agreeableness]",Your compassionate nature makes you a great role model—set an example with mindful snacking habits.
"[Snacking Habits, Agreeableness]","Eat with awareness and kindness—whether it's a small snack or a full meal, your choices matter."
"[Snacking Habits, Agreeableness]",Make snack time social—healthy habits are easier to maintain when shared with others.
