Behavior_Big5,Message
"[Speed of Eating, Extraversion]",Slow down and enjoy your meals—good food and great company deserve your full attention.
"[Speed of Eating, Extraversion]",Engage in conversation during meals to naturally pace your eating and savor each bite.
"[Speed of Eating, Extraversion]",Use mindful eating as a way to enhance social dining—pause between bites and listen to others.
"[Speed of Eating, Extraversion]",Make a habit of putting your fork down between bites to give yourself time to enjoy the flavors.
"[Speed of Eating, Extraversion]",Turn mealtime into an engaging experience—focus on the conversation as much as the food.
"[Speed of Eating, Extraversion]",Chew each bite thoroughly before taking the next—your digestion and enjoyment will thank you.
"[Speed of Eating, Extraversion]","Be the leader in your social circle—set the pace for mindful, slow eating."
"[Speed of Eating, Extraversion]",Use smaller utensils or chopsticks to naturally slow down your eating speed.
"[Speed of Eating, Extraversion]",Challenge yourself to take smaller bites and enjoy the full taste of your meal.
"[Speed of Eating, Extraversion]",Eating too fast can make you miss out on flavors—take a moment to truly savor your food.
"[Speed of Eating, Extraversion]",Turn mealtime into a shared experience—discuss the textures and flavors of your food with others.
"[Speed of Eating, Extraversion]",Practice mindful breathing between bites to bring awareness to your eating pace.
"[Speed of Eating, Extraversion]",Pacing your meals allows your body to recognize fullness cues and prevent overeating.
"[Speed of Eating, Extraversion]","When dining out, engage in meaningful conversations to slow down your eating pace naturally."
"[Speed of Eating, Extraversion]",Take breaks between bites—this allows you to connect with those around you and enjoy the moment.
"[Speed of Eating, Extraversion]",Make mindful eating fun by challenging friends to a ‘slow eating’ meal experience.
"[Speed of Eating, Extraversion]",Use a timer to see if you can extend your mealtime by a few extra minutes.
"[Speed of Eating, Extraversion]","Choose fiber-rich foods that require more chewing, naturally slowing down your eating speed."
"[Speed of Eating, Extraversion]","Appreciate each bite by noticing the textures, flavors, and aromas of your meal."
"[Speed of Eating, Extraversion]",Set an intention before meals to eat mindfully and stay present with your food and company.
"[Speed of Eating, Extraversion]",Sip water between bites to slow your pace and aid digestion.
"[Speed of Eating, Extraversion]",Try eating without distractions—focusing on your meal can help you slow down and enjoy each bite.
"[Speed of Eating, Extraversion]",Make meals a multisensory experience—observe the colors and smells before taking each bite.
"[Speed of Eating, Extraversion]",Practice gratitude for your food before eating—it helps set a mindful eating pace.
"[Speed of Eating, Extraversion]","Turn off fast-paced media during meals to encourage slower, more intentional eating."
"[Speed of Eating, Extraversion]",Use a mindful eating app to track your eating speed and develop healthier habits.
"[Speed of Eating, Extraversion]","Before reaching for the next bite, check in with your hunger levels."
"[Speed of Eating, Extraversion]",Slow eating helps digestion and allows you to feel satisfied with less food.
"[Speed of Eating, Extraversion]",Mindful eating leads to better enjoyment—give yourself permission to eat at a relaxed pace.
"[Speed of Eating, Extraversion]",Encourage your social group to adopt mindful eating habits—slow eating can be a shared experience.
